{
  "schema_version": "1.0",
  "monitoring_id": "synthetic-bus-lane-no-action",
  "story_id": "city-bus-lane-parked-cars",
  "checked_at": "2026-08-20T12:00:00Z",
  "development_url": "https://example.com/synthetic-bus-lane-signage",
  "development_type": "status_change",
  "recommendation": "no_action",
  "recommendation_confidence": "high",
  "recommendation_reasons": ["The fictional city added temporary signs, but the development does not alter the fictional lane design or the accuracy and significance of the original sample."],
  "original_story_accurate": true,
  "material_change": false,
  "materiality_rationale": "Temporary signage is routine context and does not materially advance or contradict the fictional institutional failure.",
  "development_summary": "SYNTHETIC MONITORING EXAMPLE: The fictional transportation department placed temporary signs beside the already completed imaginary bus lane while leaving the imaginary parked cars in place.",
  "sources": [{ "source_id": "synthetic-sign-notice", "name": "Synthetic City Sign Notice — not real", "url": "https://example.com/synthetic-bus-lane-signage", "source_type": "government", "claims_supported": ["signs-added"] }],
  "claims": [{ "claim_id": "signs-added", "claim_text": "The fictional city added temporary signs beside the fictional lane.", "material": false, "verification_status": "verified", "source_refs": ["synthetic-sign-notice"], "qualification": "This is an entirely synthetic fixture and not a real municipal development." }],
  "source_conflicts": [],
  "qualification_required": true,
  "do_not_claim": ["Do not treat routine fictional signage as proof that the original sample was false or corrected."],
  "factual_risk": "low",
  "legal_risk": "low",
  "sensitive_subject": false,
  "victim_targeting_risk": "low",
  "affected_original_claims": [{ "field": "summary", "original_text": "An imaginary transportation department completes an imaginary bus lane without moving the imaginary vehicles blocking it.", "impact": "still_accurate" }],
  "superseded_facts": [],
  "proposed_update": null,
  "proposed_correction": null,
  "proposed_follow_up": null,
  "human_decision": null,
  "human_notes": [],
  "reviewed_at": null
}
