{
  "schema_version": "1.0",
  "monitoring_id": "synthetic-federal-portal-follow-up",
  "story_id": "federal-portal-login-reset",
  "checked_at": "2026-08-20T13:00:00Z",
  "development_url": "https://example.com/synthetic-portal-expansion",
  "development_type": "policy_change",
  "recommendation": "follow_up",
  "recommendation_confidence": "high",
  "recommendation_reasons": ["The fictional agency expanded the same circular login requirement to a second major service, creating a distinct and materially broader systemic development."],
  "original_story_accurate": true,
  "material_change": true,
  "materiality_rationale": "The original fictional account-recovery failure remains accurate, while expansion to benefit enrollment substantially broadens the affected process and supports a separate follow-up.",
  "development_summary": "SYNTHETIC MONITORING EXAMPLE: The invented national agency extended its imaginary login-to-reset-login rule to a fictional benefit-enrollment portal.",
  "sources": [{ "source_id": "synthetic-expansion-bulletin", "name": "Synthetic Federal Portal Bulletin — not real", "url": "https://example.com/synthetic-portal-expansion", "source_type": "government", "claims_supported": ["portal-expanded"] }],
  "claims": [{ "claim_id": "portal-expanded", "claim_text": "The fictional circular authentication rule was extended to a second fictional federal service.", "material": true, "verification_status": "verified", "source_refs": ["synthetic-expansion-bulletin"], "qualification": "The agency, service, and bulletin are synthetic test data." }],
  "source_conflicts": [],
  "qualification_required": true,
  "do_not_claim": ["Do not imply that a real federal service adopted this fictional policy.", "Do not describe later expansion as proof the original fictional account was inaccurate."],
  "factual_risk": "low",
  "legal_risk": "low",
  "sensitive_subject": false,
  "victim_targeting_risk": "low",
  "affected_original_claims": [{ "field": "summary", "original_text": "An invented national agency launches an imaginary account-recovery system that requires users to access the account they cannot access.", "impact": "still_accurate" }],
  "superseded_facts": [],
  "proposed_update": null,
  "proposed_correction": null,
  "proposed_follow_up": {
    "id": "fictional-federal-portal-expands-login-loop",
    "headline": "FICTIONAL FOLLOW-UP — Federal Login Loop Expands to Benefits Portal",
    "summary": "This is a synthetic monitoring fixture, not reporting. An invented agency has extended its imaginary circular account-recovery rule to a second fictional service, materially broadening the same made-up institutional failure.",
    "fml_kicker": "FICTIONAL KICKER: One locked door has achieved federal scalability.",
    "category": "National",
    "severity": 3,
    "topic_tags": ["synthetic monitoring", "technology", "follow-up"],
    "sources": [{ "name": "Synthetic Federal Portal Bulletin — not real", "url": "https://example.com/synthetic-portal-expansion" }]
  },
  "human_decision": null,
  "human_notes": [],
  "reviewed_at": null
}
