{
  "schema_version": "1.0",
  "monitoring_id": "synthetic-rail-correction-review",
  "story_id": "imaginary-rail-upgrade",
  "checked_at": "2026-08-20T14:00:00Z",
  "development_url": "https://example.com/synthetic-rail-engineering-correction",
  "development_type": "material_factual_correction",
  "recommendation": "correction_review",
  "recommendation_confidence": "high",
  "recommendation_reasons": ["A synthetic authoritative engineering correction says the fictional platforms did fit the fictional trains, directly contradicting a material assertion in the original sample."],
  "original_story_accurate": false,
  "material_change": true,
  "materiality_rationale": "The corrected fictional engineering record changes the identified cause of the failure rather than merely describing a later event.",
  "development_summary": "SYNTHETIC MONITORING EXAMPLE: A made-up engineering office says its fictional earlier notice misstated the problem; the imaginary platforms fit, but imaginary signal software prevented service.",
  "sources": [{ "source_id": "synthetic-engineering-correction", "name": "Synthetic Rail Engineering Correction — not real", "url": "https://example.com/synthetic-rail-engineering-correction", "source_type": "official_response", "claims_supported": ["platforms-fit"] }],
  "claims": [{ "claim_id": "platforms-fit", "claim_text": "The fictional platforms fit the fictional trains; incompatible fictional signal software was the actual cause.", "material": true, "verification_status": "verified", "source_refs": ["synthetic-engineering-correction"], "qualification": "This correction scenario and every entity in it are synthetic." }],
  "source_conflicts": [{ "description": "The synthetic correction conflicts with the original fictional platform-fit assertion and resolves it in favor of the later engineering record.", "source_refs": ["synthetic-engineering-correction"], "resolved": true }],
  "qualification_required": true,
  "do_not_claim": ["Do not attribute the fictional error to misconduct or deception without evidence.", "Do not present this synthetic correction as a real rail event."],
  "factual_risk": "medium",
  "legal_risk": "low",
  "sensitive_subject": false,
  "victim_targeting_risk": "low",
  "affected_original_claims": [{ "field": "summary", "original_text": "The invented transit authority renovates an invented station before discovering its imaginary platforms do not fit the imaginary trains.", "impact": "inaccurate" }],
  "superseded_facts": [],
  "proposed_update": null,
  "proposed_correction": {
    "original_fact": "The fictional platforms did not fit the fictional trains.",
    "corrected_fact": "The fictional platforms fit; fictional signal software prevented service.",
    "correction_reason": "The synthetic engineering office corrected the same-period technical record underlying the original fictional assertion.",
    "source_refs": ["synthetic-engineering-correction"],
    "correction_note": "Correction: This fictional sample originally said the imaginary platforms did not fit. The synthetic corrected record says the platforms fit and imaginary signal software caused the failure.",
    "revised_fields": { "summary": "This story is entirely fictional and exists only to demonstrate the interface. The invented transit authority renovated an invented station before discovering that imaginary signal software, not platform dimensions, prevented its imaginary trains from operating." }
  },
  "proposed_follow_up": null,
  "human_decision": null,
  "human_notes": [],
  "reviewed_at": null
}
